{
  "run_id": "fb160150-be4e-4178-94b6-68d1ba84a31f",
  "phase": 9,
  "phase_name": "complete",
  "completed_skills": [
    "unit-test",
    "api-test",
    "security-test",
    "contract-test",
    "execute"
  ],
  "started_at": "2026-04-30T07:34:15.022930Z",
  "updated_at": "2026-04-30T07:45:52.469962+00:00",
  "completed": true
}